{
  "tool_name": "cde_healthCheck",
  "category": "health",
  "test_date": "2025-11-24T13:45:00Z",
  "tested_by": "Antigravity (AI Agent)",
  "test_scenario": "Check system health using cde_healthCheck",
  "input": {},
  "expected_output": {
    "status": "ok",
    "components": "..."
  },
  "actual_output": {
    "status": "ok",
    "python": "available",
    "rust": "available"
  },
  "result": "success",
  "feedback": {
    "usability": {
      "rating": 5,
      "comments": "Very easy to use, no parameters required."
    },
    "accuracy": {
      "rating": 5,
      "comments": "Correctly identified Python and Rust status."
    },
    "performance": {
      "duration_ms": 11,
      "comments": "Extremely fast (11ms)."
    },
    "documentation": {
      "rating": 4,
      "comments": "Docstring is clear."
    },
    "errors_encountered": [],
    "improvement_suggestions": [
      "Include disk space warning threshold in output."
    ]
  }
}
